{
  "$schema": "http://json-schema.org/draft-04/schema#",
  "type": "object",
  "properties": {
    "category": {
      "type": "string"
    },
    "title": {
      "type": "string"
    },
    "lang": {
      "type": "string"
    },
    "author": {
      "type": "string"
    },
    "year": {
      "type": "integer"
    },
    "price": {
      "type": "number"
    }
  },
  "required": [
    "category",
    "title",
    "lang",
    "author",
    "year",
    "price"
  ]
}